word,frequency,standard_definition,standard_example
google,27,"To search for information on the internet using the Google search engine, or to search for information online in general.",I'll google that restaurant to see their menu.
subreddit,16,"Any of the subforums, generally intended for discussion of a specific topic, on the Reddit web site.",
reddit,11,"A social media platform and online community where users can post content and participate in discussions in topic-based communities called subreddits.",
backgrounds,11,"One's social heritage, or previous life; what one did in the past.",The lawyer had a background in computer science.
faq,11,"A list of questions said to be frequently asked, and their answers.",This site's FAQ says you should log in to access some pages.
brainrot,9,"Internet slang referring to low-quality online content, especially on social media, that is considered mindless entertainment with no educational value.","That TikTok video was pure brainrot."
meme,7,"Any unit of cultural information, such as a practice or idea, that is transmitted verbally or by repeated action from one mind to another in a comparable way to the transmission of genes.",
examripper,5,"A tool or software used for extracting or copying exam-related content, often associated with academic dishonesty.",
icl,4,"Internet slang acronym for 'I can't lie,' used to emphasize honesty or sincerity in a statement.","ICL, that movie was actually really good."
vro,4,"Slang variation of 'bro,' popularized by rapper XXXTentacion, sometimes meaning 'very rare only' or used as a casual greeting.","What's up, vro?"
feels,4,Of or relating to the emotions.,emotional crisis
bro,4,Brother; a male sibling,
unc,4,"Slang for 'uncle' or an older male figure, often used to describe someone who's acting older than their age or out of touch.","He's giving off major unc energy with that outfit."
huns,4,"(used only to address someone) Honey, sweetheart, a term of endearment; a friendly term of address.",
btw,3,"Internet acronym for 'by the way,' used to introduce additional information or change topics.","BTW, the meeting got moved to 3 PM."
reels,3,"Short-form video content on social media platforms like Instagram and Facebook.",
tiktok,3,"A popular social media platform known for short-form vertical videos with music and effects.",
zot,3,"The battle cry of UC Irvine, representing the sound an anteater makes (their mascot Peter the Anteater).","Zot zot zot! Go Anteaters!"
fav,2,Favorite (US) or favourite (UK),
pmo,2,"Internet slang meaning 'piss me off' or 'put me on' depending on context.","That comment really PMO" or "Can you PMO with your friend?"
kinda,2,Kind of; somewhat,I kinda hafta do this right now.
labubu,2,"A collectible designer toy character created by Hong Kong artist Kasing Lung, became viral after being spotted with celebrities like BLACKPINK's Lisa.",
boi,2,"Internet slang spelling of 'boy,' used in various contexts including memes and LGBTQ+ communities.","That's my boi right there."
ayo,2,"Slang greeting combining 'hey' and 'yo,' also used to call out something suspicious or inappropriate.","Ayo, what did you just say?"
alphas,2,"The name of the first letter of the Greek alphabet (Α,  α), followed by beta. In the Latin alphabet it is the predecessor to A.",
lol,1,"Internet acronym for 'laughing out loud,' used to indicate amusement or that something is funny.","That joke made me lol."
karmafarm,1,"Reddit term for accounts or posts designed specifically to gain karma points through easy upvotes.",
cooked,1,"Internet slang meaning 'done for,' 'finished,' or 'in trouble.'","After that mistake, he's totally cooked."
fortnite,1,"A popular online battle royale video game developed by Epic Games.",
omegle,1,"An online chat website that randomly pairs users for anonymous conversations.",
jorts,1,"Jean shorts, a pair of shorts made from denim (especially, mid-thigh or knee-length)",
dms,1,"Internet acronym for 'direct messages,' private messages sent through social media platforms.","Slide into my DMs."
blm,1,"Acronym for 'Black Lives Matter,' a decentralized political and social movement advocating against violence toward black people.",
gifs,1,"Graphics Interchange Format files, short animated images commonly shared on social media and messaging platforms.",
tryna,1,"Internet slang contraction of 'trying to.'","I'm tryna get some sleep."
lowkey,1,"Slang meaning 'somewhat,' 'secretly,' or 'to a small degree.'","I'm lowkey excited about this."
bbc,1,"British Broadcasting Corporation, a British public service broadcaster.",
spinoff,1,An offshoot.,
ootl,1,"Internet acronym for 'out of the loop,' meaning unaware of recent events or information.","Can someone explain? I'm OOTL."
looped,1,To form something into a loop.,
nyt,1,"Acronym for 'New York Times,' a major American newspaper.","Did you see that NYT article?"
paparazzi,1,A paparazzo.,
genshin,1,"Short for 'Genshin Impact,' a popular free-to-play action role-playing video game.",
namedropped,1,"To casually mention a well-known or illustrious person or the titles of their works, often implying familiarity or association, especially in order to impress others, increase one's status, or to appear knowledgeable or fashionable.",,
doja,1,"Likely referring to Doja Cat, a popular American rapper, singer, and songwriter known for viral internet presence.",
backstabbing,1,"To attack someone (especially verbally) unfairly in a deceitful, underhand, or treacherous manner, especially when they're not present in the place or situation that it happens. (as if stabbing them in the back). See backbite.",
riddled,1,To speak ambiguously or enigmatically.,,
hype,1,Promotion or propaganda; especially exaggerated claims.,"After all the hype for the diet plan, only the results ended up slim."
clickbait,1,"Website content that is aimed at generating advertising revenue, especially at the expense of quality or accuracy, relying on sensationalist headlines to attract click-throughs; such headlines.",
bandwagon,1,A large wagon used to carry a band of musicians in a parade.,

